{
  "schema_version": "1.0",
  "plan_id": "plan_a3f5b2c8",
  "review_id": "dag_review_20250108T101500Z_0001",
  "reviewer_agent_id": "agent_architecture_expert",
  "reviewed_at": "2025-01-08T10:15:00Z",
  "dag": {
    "file_name": "task_dag.json",
    "sha256": "sha256:REPLACE_ME"
  },
  "score": 78,
  "decision": "REVISE",
  "criteria_version": "dag_review_rubric.v1",
  "score_breakdown": [
    { "key": "executability", "name": "可执行性", "score": 80, "max": 100, "notes": "Tasks are runnable with declared inputs." },
    { "key": "dependencies", "name": "依赖正确性", "score": 70, "max": 100, "notes": "Some dependencies need clarification." },
    { "key": "io_completeness", "name": "输入输出闭合", "score": 75, "max": 100, "notes": "Missing acceptance evidence for some outputs." },
    { "key": "routing_completeness", "name": "路由完整性", "score": 60, "max": 100, "notes": "Some outputs have unclear recipients." },
    { "key": "risk_coverage", "name": "风险覆盖", "score": 70, "max": 100, "notes": "Risks identified but mitigation incomplete." }
  ],
  "scores": {
    "executability": 80,
    "dependencies": 70,
    "io_completeness": 75,
    "routing_completeness": 60,
    "risk_coverage": 70
  },
  "issues": [
    {
      "severity": "HIGH",
      "category": "ROUTING",
      "message": "task_002 output database_schema.json has no deliver_to.",
      "suggestion": "Add deliver_to for database_schema.json, or add a routing_rules match."
    }
  ],
  "recommendation": "Update DAG and resubmit for review. Do not dispatch execution commands until APPROVE."
}
